{
  "schema_version": "1.0",
  "state_status": "STORED",
  "master_id": "market",
  "display_name": "MASTER MARKET",
  "master_version": "V1.2 FINAL",
  "source_path": "master_prompts/master_market_v1_2_current.md",
  "current_canonical_source_sha": "00f3aec8bf4535e050d222d2d3e5337e76a5bd94",
  "contract_path": "state/master_market_v1_2_contract.json",
  "run": {
    "run_type": "OFFICIAL",
    "run_id": "MMARKET-V12-20260907-0900-KST",
    "executed_kst": "2026-09-07T09:00:00+09:00",
    "updated_kst": null,
    "prior_official_run_id": "MMARKET-V12-20260907-0500-KST"
  },
  "validity": {
    "valid_until_kst": null,
    "next_official_run_kst": null,
    "freshness_status": "UNKNOWN"
  },
  "data_quality": {
    "coverage_pct": 89,
    "confidence": "B",
    "known_na": ["DETAIL_NOT_PERSISTED_IN_LEGACY_HISTORY"],
    "stale_sources": [],
    "time_mismatch_warnings": [],
    "source_health_snapshot_pointer": "source_health/output/latest.json"
  },
  "decision": {
    "direction": "SHORT",
    "permission_or_environment": null,
    "action": null,
    "risk_veto": ["OIL_SHOCK", "OPEC_UNCHANGED", "HAWKISH_JOBS", "HIGH_REAL_YIELD"],
    "invalidations": []
  },
  "core_state": {
    "market_positive": 44,
    "liquidity_lead": 37,
    "crypto_money_inflow": 61,
    "alt_money_inflow": 44
  },
  "lineage": {
    "state_origin": "ACTUAL_STORED_RUN",
    "run_record_source": "state/master_market_official_history.csv",
    "history_pointer": "official_state/history/market/2026-09.jsonl",
    "canonical_identity_verified": true,
    "cross_master_decision_dependency": false
  },
  "privacy": {
    "contains_personal_account_data": false,
    "public_repository_safe": true
  },
  "do_not_reconstruct": [
    "valid_until_kst not persisted in legacy history",
    "next_official_run_kst not persisted in legacy history",
    "permission/action/invalidation not persisted in legacy history",
    "current market values from the 09:00 run"
  ]
}
