{
  "schema_version": "1.0",
  "state_status": "STORED",
  "master_id": "btc_trend",
  "display_name": "MASTER BTC TREND",
  "master_version": "V2.6 PRODUCTION",
  "source_path": "master_prompts/master_btc_trend_v2_6_current.md",
  "contract_path": "state/master_btc_trend_v2_6_contract.json",
  "run": {
    "run_type": "OFFICIAL",
    "run_id": "MBTC-V26-20260910-1700-KST",
    "executed_kst": "2026-09-10T17:00:00+09:00",
    "updated_kst": "2026-09-10T17:00:00+09:00",
    "prior_official_run_id": "MBTC-V26-20260910-0800-KST"
  },
  "validity": {
    "valid_until_kst": null,
    "next_official_run_kst": "2026-09-10T21:00:00+09:00",
    "freshness_status": "CURRENT"
  },
  "data_quality": {
    "coverage_pct": null,
    "confidence": null,
    "known_na": [
      "FRACTAL_CURRENT_ARTIFACT_UNAVAILABLE",
      "SR_STRENGTH_CURRENT_REACTION_MODEL_UNAVAILABLE"
    ],
    "stale_sources": [],
    "time_mismatch_warnings": [],
    "source_health_snapshot_pointer": "source_health/output/latest.json"
  },
  "decision": {
    "direction": "LONG",
    "permission_or_environment": "LONG_SLIGHT_EDGE_NEUTRAL_BAND_WAIT_FOR_SUPPORT_CONFIRMATION",
    "action": "⏳ 아직 신규포지션 대기",
    "risk_veto": [],
    "invalidations": [
      "76.2K 하향 이탈 시 중기 상승구조 약화",
      "67.0K 하회 시 LIVE LONG PLAN 구조 무효"
    ]
  },
  "core_state": {
    "market_snapshot": {
      "current_price_usdt": 78146.25,
      "price_source": "Binance Spot BTCUSDT",
      "price_change_24h_pct": -1.3133393005707594,
      "latest_completed_1h_close_usdt": 78112.0,
      "latest_completed_4h_close_usdt": 78112.0
    },
    "direction_ratio": {
      "long": 51,
      "short": 49,
      "dominant": "LONG_SLIGHT_NEUTRAL_BAND"
    },
    "trend": {
      "state": "장기 회복 구조 유지 · 중기 조정 지속 · 단기 78K 지지 재시험",
      "strength": null,
      "trajectory": "→ 약세 조정 유지"
    },
    "support_resistance": {
      "short_term": {
        "support": "77.77~78.0K",
        "resistance": "78.9~79.5K",
        "strength": "강도 대기"
      },
      "mid_term": {
        "support": "76.2~76.8K",
        "resistance": "79.9~80.6K",
        "strength": "강도 대기"
      },
      "long_term": {
        "support": "69.3~70.8K",
        "resistance": "82.3~82.8K",
        "strength": "검증대기"
      }
    },
    "derivatives": {
      "source": "Bitget USDT Futures BTC same venue/contract family",
      "snapshot_time_utc": "2026-09-10T07:00:00Z",
      "status": "OK_FRESH_UNDER_90M_AT_ANALYSIS",
      "open_interest_usdt": 2783730490.0939913,
      "oi_change_1h_pct": 0.18605102124711337,
      "price_change_1h_pct": 0.006908498220403736,
      "oi_change_4h_pct": -0.07192993225096922,
      "price_change_4h_pct": -0.23368571249894332,
      "oi_change_24h_pct": 1.1540098118756115,
      "price_change_24h_pct": -1.3133393005707594,
      "funding_rate": 0.0001,
      "state": "MIXED_DELEVERAGING_WITH_24H_OI_BUILD"
    },
    "microstructure": {
      "snapshot_time_utc": "2026-09-10T07:20:11.707905Z",
      "status": "OK_FULL_7_OF_7",
      "cvd_1h_usdt": -3717974.506760001,
      "taker_buy_ratio": 0.471708360270428,
      "taker_sell_ratio": 0.5282916397295719,
      "long_short_position_ratio": 0.9719,
      "depth_imbalance_0_5pct": -0.12257046698317496,
      "state": "BEARISH_CVD_TAKER_SELL_AND_ASK_DEPTH_DOMINANT"
    },
    "btc_leading_signal_engine": {
      "mode": "READ_ONLY_AUXILIARY",
      "selection_status": "CURRENT",
      "expected_source_slot_kst": "2026-09-10T13:20:00+09:00",
      "actual_source_kst": "2026-09-10T13:30:44+09:00",
      "strict_detection_rows": 0,
      "strict_seeds": 0,
      "positions": 0,
      "ledger_integrity": "PASS",
      "frozen_identity": "PASS",
      "current_user_state": "신호 없음 / 대기",
      "production_weight": 0
    },
    "fractal": {
      "current_status": "N/A_CURRENT_ARTIFACT_UNAVAILABLE",
      "master_weight": 0
    },
    "long_a_plus_tracking": {
      "prospective_cases": 0,
      "matured_cases": 0,
      "active": false
    },
    "live_long_plan": {
      "plan_id": "BTC-SWING-20260902-03",
      "T1": "76.3~76.8K / 2%",
      "T2": "74.5~75.2K / 4%",
      "T3": "69.3~70.8K / 6%",
      "structural_sl": "67.0K",
      "targets": [
        "79.3K",
        "81.5K",
        "82.8K"
      ],
      "status": "UNCHANGED"
    }
  },
  "lineage": {
    "state_origin": "ACTUAL_STORED_RUN",
    "run_record_source": "BASIC_OFFICIAL_AUTOMATION_2026-09-10T17:00:00+09:00",
    "history_pointer": "official_state/history/btc_trend/2026-09.jsonl",
    "canonical_identity_verified": true,
    "cross_master_decision_dependency": false
  },
  "privacy": {
    "contains_personal_account_data": false,
    "public_repository_safe": true
  },
  "do_not_reconstruct": [
    "missing historical values",
    "unavailable current fractal artifact",
    "unavailable S/R strength artifact",
    "private user account or position data"
  ]
}
