{
  "schema_version": "1.0",
  "state_status": "STORED",
  "master_id": "btc_trend",
  "display_name": "MASTER BTC TREND",
  "master_version": "V2.6 PRODUCTION",
  "source_path": "master_prompts/master_btc_trend_v2_6_current.md",
  "contract_path": "state/master_btc_trend_v2_6_contract.json",
  "run": {
    "run_type": "OFFICIAL",
    "run_id": "MBTC-V26-20260915-0500-KST",
    "executed_kst": "2026-09-15T05:00:00+09:00",
    "updated_kst": "2026-09-15T05:00:00+09:00",
    "prior_official_run_id": "MBTC-V26-20260914-2100-KST"
  },
  "validity": {
    "valid_until_kst": null,
    "next_official_run_kst": "2026-09-15T08:00:00+09:00",
    "freshness_status": "CURRENT"
  },
  "data_quality": {
    "coverage_pct": null,
    "confidence": null,
    "known_na": [
      "FRACTAL_CURRENT_ARTIFACT_UNVERIFIED",
      "SR_STRENGTH_CURRENT_REACTION_MODEL_UNVERIFIED"
    ],
    "stale_sources": [],
    "time_mismatch_warnings": [],
    "source_health_snapshot_pointer": "source_health/output/latest.json"
  },
  "decision": {
    "direction": "LONG",
    "permission_or_environment": "LONG_DOMINANT_GAP10_WAIT_NONCHASE",
    "action": "⏳ 아직 신규포지션 대기",
    "risk_veto": [],
    "invalidations": [
      "79.325K 돌파·안착 실패 후 78.838K 하회 시 단기 상승 모멘텀 약화",
      "78.301K 하회 시 현재 중기 반등 구조 약화",
      "76.389K 하회 시 현재 반등 구조 훼손",
      "67.0K 하회 시 기존 LIVE LONG PLAN 구조 무효"
    ]
  },
  "core_state": {
    "market_snapshot": {
      "current_price_usdt": 78996.01,
      "price_source": "Binance Spot BTCUSDT",
      "latest_completed_1h_close_usdt": 78982.0,
      "latest_completed_4h_close_usdt": 78982.0,
      "latest_completed_1d_close_usdt": 78521.06,
      "current_progressing_1d_price_usdt": 78978.56
    },
    "direction_ratio": {
      "long": 55,
      "short": 45,
      "dominant": "LONG",
      "status": "CURRENT_LIMITED_DISPLAY_COVERAGE_68"
    },
    "trend": {
      "state": "76.389K 저점 반등 이후 79.325K까지 고점을 확장하고 79K 부근을 유지하며 LONG 우세로 전환",
      "strength": 10,
      "trajectory": "↑ LONG 우세 진입",
      "coverage_pct": 68.0,
      "coverage_grade": "C",
      "strong_confirmation": false
    },
    "bottom": {
      "score": 31,
      "band": "낮음",
      "coverage_pct": 57.0,
      "coverage_grade": "C",
      "entry_gate_effect": 0
    },
    "top": {
      "score": 38,
      "band": "낮음",
      "coverage_pct": 50.0,
      "coverage_grade": "C",
      "entry_gate_effect": 0
    },
    "accumulation": {
      "score": 50,
      "status": "가능성 관찰",
      "coverage_pct": 53.0,
      "coverage_grade": "C",
      "entry_gate_effect": 0
    },
    "support_resistance": {
      "short_term": {
        "support": "78.838K recent completed-1H low",
        "resistance": "79.325K current-day high",
        "strength": "N/A_CURRENT_REACTION_MODEL_UNVERIFIED"
      },
      "mid_term": {
        "support": "78.301K current-day low",
        "resistance": "79.890K recent swing high",
        "strength": "N/A_CURRENT_REACTION_MODEL_UNVERIFIED"
      },
      "long_term": {
        "support": "76.046K recent weekly low",
        "resistance": "82.300K recent swing high",
        "strength": "1W_NOT_APPROVED_INSUFFICIENT_SAMPLE"
      }
    },
    "derivatives": {
      "source": "Bitget USDT Futures BTC same venue/contract family",
      "snapshot_time_utc": "2026-09-14T19:00:00Z",
      "status": "PRICE_UP_OI_DOWN_SQUEEZE_RISK_WITH_BUY_MICROSTRUCTURE",
      "mark_price": 79110.9,
      "oi_change_1h_pct": -1.156778467902464,
      "oi_change_4h_pct": -1.5714158139102374,
      "oi_change_24h_pct": -4.1864157056224265,
      "funding_rate": 0.000034,
      "microstructure_generated_at_utc": "2026-09-14T19:19:03.044617Z",
      "cvd_notional_usdt": 27750461.882740006,
      "taker_buy_ratio": 0.5717307312723712,
      "taker_sell_ratio": 0.42826926872762877,
      "long_position_ratio": 0.4959,
      "short_position_ratio": 0.5041,
      "basis_bps": -5.053631666852576
    },
    "btc_leading_signal_engine": {
      "mode": "READ_ONLY_ZERO_WEIGHT",
      "selection_status": "CURRENT",
      "logical_source_slot_kst": "2026-09-14T21:20:00+09:00",
      "current_user_state": "신호 없음 / 대기",
      "strict_detection_rows": 0,
      "strict_seeds": 0,
      "positions": 0,
      "ledger_integrity": "PASS",
      "frozen_identity": "PASS",
      "production_weight": 0,
      "verification_note": "Expected previous-day 21:20 logical slot verified: workflow completed success before 05:00, same-run artifact matched, latest.md/state.json file hashes and recomputed snapshot hash matched provenance, ledger integrity passed, frozen identity checks passed."
    },
    "fractal": {
      "current_status": "N/A_CURRENT_ARTIFACT_UNVERIFIED",
      "master_weight": 0
    },
    "long_a_plus_prospective": {
      "tracking_start_date": "2026-09-04",
      "prospective_cases": 0,
      "matured_cases": 0,
      "current_active": false,
      "no_backfill": true
    },
    "live_long_plan": {
      "plan_id": "BTC-SWING-20260902-03",
      "T1": "76.3~76.8K / 2%",
      "T2": "74.5~75.2K / 4%",
      "T3": "69.3~70.8K / 6%",
      "structural_sl": "67.0K",
      "targets": ["79.3K", "81.5K", "82.8K"],
      "status": "CARRIED_FORWARD_NOT_INVALIDATED"
    }
  },
  "lineage": {
    "state_origin": "ACTUAL_STORED_RUN",
    "run_record_source": "BASIC_OFFICIAL_AUTOMATION_2026-09-15T05:00:00+09:00",
    "history_pointer": "official_state/history/btc_trend/2026-09.jsonl",
    "canonical_identity_verified": true,
    "cross_master_decision_dependency": false
  },
  "privacy": {
    "contains_personal_account_data": false,
    "public_repository_safe": true
  },
  "do_not_reconstruct": [
    "unverified current fractal artifact",
    "unverified S/R strength reaction artifact",
    "private user account or position data"
  ]
}
