{
  "schema_version": "1.0",
  "state_status": "STORED",
  "master_id": "alt_top100",
  "display_name": "MASTER ALT 1 · TOP100",
  "master_version": "V4.8 FINAL",
  "source_path": "master_prompts/master_alt_top100_v4_8_current.md",
  "current_canonical_source_sha": "27af5ac7f9acf4250f08ce06b601459e644da726",
  "contract_path": null,
  "run": {
    "run_type": "OFFICIAL",
    "run_id": "ALT_TOP100_20260914_1030",
    "executed_kst": "2026-09-14T10:30:00+09:00",
    "updated_kst": "2026-09-14T10:30:00+09:00",
    "prior_official_run_id": "ALT_TOP100_20260909_1030"
  },
  "validity": {
    "valid_until_kst": "2026-09-15T10:30:00+09:00",
    "next_official_run_kst": "2026-09-15T10:30:00+09:00",
    "freshness_status": "CURRENT"
  },
  "data_quality": {
    "coverage_pct": 80,
    "confidence": "B+",
    "known_na": ["TOTAL3_DIRECT_SR_NOT_CONFIRMED_THIS_RUN"],
    "stale_sources": [],
    "time_mismatch_warnings": [],
    "source_health_snapshot_pointer": "source_health/output/latest.json"
  },
  "decision": {
    "direction": "DEFENSIVE_SELECTIVE_LONG",
    "permission_or_environment": "ALT_MARKET_59_100_DEFENSIVE_SELECTIVE",
    "action": "WAIT_FOR_NONCHASE_RECLAIM",
    "risk_veto": ["BROAD_ALT_BREADTH_WEAK", "BTC_DOMINANCE_ELEVATED", "EXTENDED_FIL_ZEC_UNI"],
    "invalidations": ["BROAD_MARKET_PARTICIPATION_WEAKENS_FURTHER", "BTC_DOMINANCE_REACCELERATES_WITH_ALT_RS_DETERIORATION"]
  },
  "core_state": {
    "alt_market_score": 59,
    "delta_score": -14,
    "delta_reason": "MARKET_CAP_AND_PARTICIPATION_WEAKER_BTC_DOMINANCE_HIGHER_ALT_BREADTH_WEAK",
    "market_snapshot": {
      "global_market_cap_usd": 2612606593703,
      "global_24h_volume_usd": 54789800930,
      "btc_dominance_pct": 58.89,
      "eth_dominance_pct": 11.57
    },
    "best3": [
      {"ticker":"TRX","direction":"LONG","trend_score":78,"hunter_score":79,"accum_score":76,"early_score":78,"trend_flip_score":77,"breakout_ready_score":81,"absorption_score":74,"non_chase":true,"status":"WAIT","trigger":"0.3442 above completed 30m close then retest hold"},
      {"ticker":"HBAR","direction":"LONG","trend_score":72,"hunter_score":76,"accum_score":78,"early_score":72,"trend_flip_score":69,"breakout_ready_score":74,"absorption_score":74,"non_chase":true,"status":"WAIT","trigger":"0.07752 reclaim on completed 30m candle then retest hold"},
      {"ticker":"AVAX","direction":"LONG","trend_score":71,"hunter_score":75,"accum_score":75,"early_score":71,"trend_flip_score":69,"breakout_ready_score":73,"absorption_score":70,"non_chase":true,"status":"WAIT","trigger":"8.20 above completed 30m close then retest hold"}
    ],
    "pre_runner_confirmed": [],
    "actual_enter_count": 0,
    "overextended_watch": ["FIL","ZEC","UNI"]
  },
  "lineage": {
    "state_origin": "ACTUAL_STORED_RUN",
    "run_record_source": "official_state/history/alt_top100/2026-09-14T10-30-00+09-00.json",
    "history_pointer": "official_state/history/alt_top100/",
    "canonical_identity_verified": true,
    "cross_master_decision_dependency": false
  },
  "privacy": {
    "contains_personal_account_data": false,
    "public_repository_safe": true
  },
  "do_not_reconstruct": ["WATCH/provisional outputs as OFFICIAL history", "Other MASTER decisions as ALT TOP100 input"]
}