{
  "schema_version": "1.0",
  "state_status": "STORED",
  "master_id": "btc_trend",
  "display_name": "MASTER BTC TREND",
  "master_version": "V2.6 PRODUCTION",
  "source_path": "master_prompts/master_btc_trend_v2_6_current.md",
  "contract_path": "state/master_btc_trend_v2_6_contract.json",
  "run": {
    "run_type": "OFFICIAL",
    "run_id": "MBTC-V26-20260915-1300-KST",
    "executed_kst": "2026-09-15T13:00:00+09:00",
    "updated_kst": "2026-09-15T13:00:00+09:00",
    "prior_official_run_id": "MBTC-V26-20260915-0800-KST"
  },
  "validity": {
    "valid_until_kst": null,
    "next_official_run_kst": "2026-09-15T17:00:00+09:00",
    "freshness_status": "CURRENT"
  },
  "data_quality": {
    "coverage_pct": 68.0,
    "confidence": null,
    "known_na": [
      "FRACTAL_CURRENT_ARTIFACT_UNVERIFIED",
      "SR_STRENGTH_CURRENT_REACTION_MODEL_UNVERIFIED"
    ],
    "stale_sources": [],
    "time_mismatch_warnings": [],
    "source_health_snapshot_pointer": "source_health/output/latest.json"
  },
  "decision": {
    "direction": "LONG",
    "permission_or_environment": "NEUTRAL_GAP4_WAIT_NONCHASE_LONG_TIEBREAKER",
    "action": "⏳ 아직 신규포지션 대기",
    "risk_veto": [],
    "invalidations": [
      "67.0K 하회 시 기존 LIVE LONG PLAN 구조 무효"
    ]
  },
  "core_state": {
    "market_snapshot": {
      "current_price_usdt": 77662.0,
      "price_source": "CoinGecko bitcoin current market",
      "latest_completed_1h_close_usdt": null,
      "latest_completed_4h_close_usdt": null,
      "latest_completed_1d_close_usdt": null,
      "current_progressing_1d_price_usdt": 77662.0
    },
    "direction_ratio": {
      "long": 52,
      "short": 48,
      "dominant": "NEUTRAL",
      "status": "CURRENT_LIMITED_DISPLAY_COVERAGE_68"
    },
    "trend": {
      "state": "중립 · LONG 4pt 미세우위",
      "strength": 4,
      "trajectory": "↑ 08:00 49:51에서 52:48로 개선",
      "coverage_pct": 68.0,
      "coverage_grade": "C",
      "strong_confirmation": false
    },
    "bottom": {
      "score": 31,
      "band": "낮음",
      "coverage_pct": 57.0,
      "coverage_grade": "C",
      "entry_gate_effect": 0
    },
    "top": {
      "score": 38,
      "band": "낮음",
      "coverage_pct": 50.0,
      "coverage_grade": "C",
      "entry_gate_effect": 0
    },
    "accumulation": {
      "score": 50,
      "status": "가능성 관찰",
      "coverage_pct": 53.0,
      "coverage_grade": "C",
      "entry_gate_effect": 0
    },
    "support_resistance": {
      "short_term": {
        "support": null,
        "resistance": null,
        "strength": "N/A_CURRENT_REACTION_MODEL_UNVERIFIED"
      },
      "mid_term": {
        "support": null,
        "resistance": null,
        "strength": "N/A_CURRENT_REACTION_MODEL_UNVERIFIED"
      },
      "long_term": {
        "support": null,
        "resistance": null,
        "strength": "1W_NOT_APPROVED_INSUFFICIENT_SAMPLE"
      }
    },
    "derivatives": {
      "source": "Bitget USDT Futures BTC same venue/contract family",
      "snapshot_time_utc": "2026-09-15T03:00:00Z",
      "status": "CURRENT_MIXED_PRICE_DOWN_OI_4H_UP",
      "mark_price": 77729.3,
      "oi_change_1h_pct": -0.07549800786136318,
      "oi_change_4h_pct": 0.5343700700707332,
      "oi_change_24h_pct": -5.33358421772413,
      "funding_rate": 0.0001,
      "microstructure_generated_at_utc": "2026-09-15T03:20:13.231553Z",
      "cvd_notional_usdt": 2195963.806549996,
      "taker_buy_ratio": 0.5135068160665188,
      "taker_sell_ratio": 0.48649318393348123,
      "long_position_ratio": 0.323,
      "short_position_ratio": 0.677,
      "basis_bps": -3.5267311482367614
    },
    "btc_leading_signal_engine": {
      "mode": "READ_ONLY_ZERO_WEIGHT",
      "selection_status": "CURRENT",
      "logical_source_slot_kst": "2026-09-15T08:20:00+09:00",
      "current_user_state": "신호 없음 / 대기",
      "strict_detection_rows": 0,
      "strict_seeds": 0,
      "positions": 0,
      "ledger_integrity": "PASS",
      "frozen_identity": "PASS",
      "production_weight": 0,
      "verification_note": "Expected 08:20 logical slot matched to completed successful same-run artifact; provenance contract, artifact identity, ledger integrity and frozen identity checks passed; strict forward counts are zero."
    },
    "fractal": {
      "current_status": "N/A_CURRENT_ARTIFACT_UNVERIFIED",
      "master_weight": 0
    },
    "long_a_plus_prospective": {
      "tracking_start_date": "2026-09-04",
      "prospective_cases": 0,
      "matured_cases": 0,
      "current_active": false,
      "no_backfill": true
    },
    "live_long_plan": {
      "plan_id": "BTC-SWING-20260902-03",
      "T1": "76.3~76.8K / 2%",
      "T2": "74.5~75.2K / 4%",
      "T3": "69.3~70.8K / 6%",
      "structural_sl": "67.0K",
      "targets": [
        "79.3K",
        "81.5K",
        "82.8K"
      ],
      "status": "CARRIED_FORWARD_NOT_INVALIDATED"
    }
  },
  "lineage": {
    "state_origin": "ACTUAL_STORED_RUN",
    "run_record_source": "BASIC_OFFICIAL_AUTOMATION_2026-09-15T13:00:00+09:00",
    "history_pointer": "official_state/history/btc_trend/2026-09.jsonl",
    "canonical_identity_verified": true,
    "cross_master_decision_dependency": false
  },
  "privacy": {
    "contains_personal_account_data": false,
    "public_repository_safe": true
  },
  "do_not_reconstruct": [
    "unverified current fractal artifact",
    "unverified S/R strength reaction artifact",
    "private user account or position data"
  ]
}
