{
  "schema_version": "1.0",
  "state_status": "STORED",
  "master_id": "btc_trend",
  "display_name": "MASTER BTC TREND",
  "master_version": "V2.6 PRODUCTION",
  "source_path": "master_prompts/master_btc_trend_v2_6_current.md",
  "current_canonical_source_sha": "b44b32a176059e38895ee33e02abdd9adbd81e2a",
  "contract_path": "state/master_btc_trend_v2_6_contract.json",
  "run": {
    "run_type": "OFFICIAL",
    "run_id": "MBTC-V26-20260908-1710-KST",
    "executed_kst": "2026-09-08T17:10:29+09:00",
    "updated_kst": "2026-09-08T17:10:29+09:00",
    "prior_official_run_id": "MBTC-V26-20260908-0910-KST"
  },
  "validity": {
    "valid_until_kst": null,
    "next_official_run_kst": "2026-09-08T21:10:00+09:00",
    "freshness_status": "CURRENT"
  },
  "data_quality": {
    "coverage_pct": 86,
    "confidence": null,
    "known_na": [
      "FRACTAL_CURRENT_ARTIFACT_UNAVAILABLE",
      "SR_STRENGTH_CURRENT_REACTION_MODEL_UNAVAILABLE"
    ],
    "stale_sources": [],
    "time_mismatch_warnings": [],
    "source_health_snapshot_pointer": null
  },
  "decision": {
    "direction": "LONG",
    "permission_or_environment": "LONG_SLIGHT_EDGE_NEUTRAL_BAND_WAIT_FOR_SUPPORT_CONFIRMATION",
    "action": "⏳ 아직 신규포지션 대기",
    "risk_veto": [],
    "invalidations": [
      "76.2K 하향 이탈 시 중기 상승구조 약화",
      "67.0K 하회 시 LIVE LONG PLAN 구조 무효"
    ]
  },
  "core_state": {
    "market_snapshot": {
      "current_price_usdt": 78410.01,
      "price_source": "Binance Spot BTCUSDT",
      "price_checked_kst": "2026-09-08T17:08:17+09:00",
      "price_change_24h_pct": -1.323,
      "high_24h": 79643.5,
      "low_24h": 78179.98
    },
    "direction_ratio": {
      "long": 52,
      "short": 48,
      "dominant": "LONG_SLIGHT_NEUTRAL_BAND"
    },
    "accumulation_suitability": 54,
    "accumulation_score": 49,
    "bottom_score": 58,
    "top_score": 47,
    "trend": {
      "state": "장기 회복 유지 · 중기 조정 심화 · 단기 78.2K 지지 시험",
      "strength": 52,
      "trajectory": "↓ 악화 중"
    },
    "wave": {
      "large": "상승 회복 대파동은 유지되나 82.3K 이후 조정폭 확대",
      "medium": "82.3K 이후 조정파가 78K대로 심화",
      "small": "78.18K 저점 형성 후 단기 방어 시험"
    },
    "support_resistance": {
      "short": {
        "support": "78.18~78.4K",
        "resistance": "78.9~79.4K",
        "strength": "대기"
      },
      "mid": {
        "support": "76.2~76.8K",
        "resistance": "79.9~80.6K",
        "strength": "대기"
      },
      "long": {
        "support": "69.3~70.8K",
        "resistance": "≈87K",
        "strength": "검증대기"
      }
    },
    "derivatives": {
      "source": "Bitget USDT Futures BTC same venue/contract family",
      "snapshot_time_utc": "2026-09-08T07:00:00Z",
      "status": "OK_FRESH_UNDER_90M_AT_ANALYSIS",
      "oi_change_1h_pct": 1.1944391357177064,
      "price_change_1h_pct": 0.024362244897968566,
      "oi_change_4h_pct": 1.296758886143956,
      "price_change_4h_pct": -0.5747257595812849,
      "oi_change_24h_pct": 3.2803171681006438,
      "price_change_24h_pct": -1.4296757650223313,
      "funding_rate": 0.000099,
      "state": "PRICE_DOWN_OI_UP_BEARISH_BUILD"
    },
    "microstructure": {
      "snapshot_time_utc": "2026-09-08T07:20:10.969980Z",
      "cvd_1h_usdt": -10333909.183689997,
      "taker_buy_ratio": 0.45950692060198706,
      "taker_sell_ratio": 0.5404930793980129,
      "long_short_position_ratio": 0.9912,
      "depth_imbalance_0_5pct": 0.004287513360724633,
      "state": "BEARISH_CVD_TAKER_SELL_DOMINANT_DEPTH_NEUTRAL"
    },
    "spot_etf": {
      "last_confirmed_us_btc_etf_flow_date": "2026-09-04",
      "last_confirmed_us_btc_etf_flow_usd_m": 174.6,
      "flow_3d_usd_m": 1006.5,
      "flow_5d_usd_m": 986.7,
      "state": "SPOT_FLOW_SUPPORTIVE_LAST_CONFIRMED"
    },
    "macro": {
      "state": "MIXED_WITH_RISK_OFF_HEADWIND",
      "drivers": [
        "DXY near 98.84 and softer on day",
        "Brent near 97 USD",
        "carry-unwind and geopolitical risk remain headwinds"
      ]
    },
    "fractal": {
      "current_status": "N/A_CURRENT_ARTIFACT_UNAVAILABLE",
      "master_weight": 0
    },
    "long_a_plus_tracking": {
      "prospective_cases": 0,
      "matured_cases": 0,
      "active": false
    },
    "live_long_plan": {
      "plan_id": "BTC-SWING-20260902-03",
      "status": "MAINTAIN",
      "t1": "76.3~76.8K / 2%",
      "t2": "74.5~75.2K / 4%",
      "t3": "69.3~70.8K / 6%",
      "structural_sl": "67.0K",
      "targets": [
        "79.3K",
        "81.5K",
        "82.8K"
      ]
    }
  },
  "lineage": {
    "state_origin": "ACTUAL_STORED_RUN",
    "run_record_source": "BASIC_OFFICIAL_AUTOMATION_2026-09-08T17:10:29+09:00",
    "history_pointer": "official_state/history/btc_trend/2026-09.jsonl",
    "canonical_identity_verified": true,
    "cross_master_decision_dependency": false
  },
  "privacy": {
    "contains_personal_account_data": false,
    "public_repository_safe": true
  },
  "do_not_reconstruct": [
    "missing historical OFFICIAL values from chat memory",
    "legacy handoff as current V2.6 OFFICIAL state",
    "V3.0 research output as V2.6 production OFFICIAL state"
  ]
}