{
  "schema_version": "1.0",
  "state_status": "STORED",
  "master_id": "btc_trend",
  "display_name": "MASTER BTC TREND",
  "master_version": "V2.6 PRODUCTION",
  "source_path": "master_prompts/master_btc_trend_v2_6_current.md",
  "current_canonical_source_sha": "4104e5b1d079f14e07dd673fa43080047cab183a",
  "contract_path": "state/master_btc_trend_v2_6_contract.json",
  "run": {
    "run_type": "OFFICIAL",
    "run_id": "MBTC-V26-20260907-MANUAL-2203-KST",
    "executed_kst": "2026-09-07T22:03:17+09:00",
    "updated_kst": "2026-09-07T22:03:17+09:00",
    "prior_official_run_id": null
  },
  "validity": {
    "valid_until_kst": null,
    "next_official_run_kst": "2026-09-08T09:10:00+09:00",
    "freshness_status": "CURRENT"
  },
  "data_quality": {
    "coverage_pct": 86,
    "confidence": null,
    "known_na": [
      "FRACTAL_CURRENT_ARTIFACT_UNAVAILABLE",
      "SR_STRENGTH_CURRENT_REACTION_MODEL_UNAVAILABLE"
    ],
    "stale_sources": [],
    "time_mismatch_warnings": [],
    "source_health_snapshot_pointer": null
  },
  "decision": {
    "direction": "LONG",
    "permission_or_environment": "LONG_DOMINANT_WAIT_FOR_BETTER_LOCATION",
    "action": "⏳ 아직 신규포지션 대기",
    "risk_veto": [],
    "invalidations": [
      "76.2K 하향 이탈 시 중기 상승구조 약화",
      "67.0K 하회 시 LIVE LONG PLAN 구조 무효"
    ]
  },
  "core_state": {
    "market_snapshot": {
      "current_price_usdt": 79544.01,
      "price_source": "Binance Spot BTCUSDT",
      "price_checked_kst": "2026-09-07T22:02:00+09:00"
    },
    "direction_ratio": {
      "long": 57,
      "short": 43,
      "dominant": "LONG"
    },
    "accumulation_suitability": 44,
    "accumulation_score": 50,
    "bottom_score": 62,
    "top_score": 54,
    "trend": {
      "state": "장기 회복 유지 · 중기 조정 · 단기 반등 시도",
      "strength": 61,
      "trajectory": "↓ 단기 악화"
    },
    "wave": {
      "large": "상승 회복 대파동 유지, 82.3K 재시험 가능성 보존",
      "medium": "82.3K 이후 조정파 진행",
      "small": "79.0K 저점 방어 후 1H 반등 시도"
    },
    "support_resistance": {
      "short": {
        "support": "79.0~79.4K",
        "resistance": "79.9~80.6K",
        "strength": "대기"
      },
      "mid": {
        "support": "76.2~76.8K",
        "resistance": "81.1~82.3K",
        "strength": "대기"
      },
      "long": {
        "support": "69.3~70.8K",
        "resistance": "≈87K",
        "strength": "검증대기"
      }
    },
    "derivatives": {
      "source": "Bitget USDT Futures BTC same venue/contract family",
      "snapshot_time_utc": "2026-09-07T12:00:00Z",
      "status": "OK_FRESH_UNDER_90M_AT_ANALYSIS",
      "oi_change_1h_pct": 0.37910438668571356,
      "price_change_1h_pct": 0.08932384745148347,
      "oi_change_4h_pct": 1.660259849503798,
      "price_change_4h_pct": -0.03900548593286368,
      "oi_change_24h_pct": 0.7087238156113562,
      "price_change_24h_pct": -0.6239383166674606,
      "funding_rate": 0.000094,
      "state": "PRICE_DOWN_OI_UP_BEARISH_BUILD"
    },
    "spot_etf": {
      "last_confirmed_us_btc_etf_flow_date": "2026-09-04",
      "last_confirmed_us_btc_etf_flow_usd_m": 174.6,
      "prior_confirmed_us_btc_etf_flow_date": "2026-09-03",
      "prior_confirmed_us_btc_etf_flow_usd_m": 730.8,
      "state": "SPOT_FLOW_SUPPORTIVE"
    },
    "macro": {
      "state": "CAUTIOUS_RISK_OFF_HEADWIND",
      "drivers": [
        "Brent near 97 USD",
        "higher rate expectations after strong US jobs",
        "yen carry-unwind risk"
      ]
    },
    "fractal": {
      "current_status": "N/A_CURRENT_ARTIFACT_UNAVAILABLE",
      "master_weight": 0
    },
    "long_a_plus_tracking": {
      "prospective_cases": 0,
      "matured_cases": 0,
      "active": false
    },
    "live_long_plan": {
      "plan_id": "BTC-SWING-20260902-03",
      "status": "MAINTAIN",
      "t1": "76.3~76.8K / 2%",
      "t2": "74.5~75.2K / 4%",
      "t3": "69.3~70.8K / 6%",
      "structural_sl": "67.0K",
      "targets": ["79.3K", "81.5K", "82.8K"]
    }
  },
  "lineage": {
    "state_origin": "ACTUAL_STORED_RUN",
    "run_record_source": "MANUAL_OFFICIAL_CHAT_EXECUTION_2026-09-07T22:03:17+09:00",
    "history_pointer": null,
    "canonical_identity_verified": true,
    "cross_master_decision_dependency": false
  },
  "privacy": {
    "contains_personal_account_data": false,
    "public_repository_safe": true
  },
  "do_not_reconstruct": [
    "missing historical OFFICIAL values from chat memory",
    "legacy handoff as current V2.6 OFFICIAL state",
    "V3.0 research output as V2.6 production OFFICIAL state"
  ]
}
